"ID","Predict"
"817","Homeowners Empowerment and Protection Act of 1995 - Directs the Director of the"
"818","Healthy Health Disparities Act of 2017 This bill amends title XIX (Medic"
"819","Violent Juvenile Criminal Records Act of 1997 - Amends the Omnibus"
"820","Amends the Internal Revenue Code to allow the taxpayer to allow the credit for the taxable"
"821","Amends the Internal Revenue Code to allow the Secretary of Transportation to prescribe aviation tax rates for"
"822","International Gate Export Control Act of 2004 - Directs the Secretary of Commerce to approve the export"
"823","National Guard Investigations Transparency and Improvement Act of 2014 - Directs the Office of"
"824","Authorizes the Secretary of Defense to obligate and expend Cooperative Threat Reduction funds"
"825","Telephone Television and Radio Program Violence Reduction Act of 1993 - Directs the Federal Communications Commission"
"826","directs the Department of Commerce and the finalergebnis of the administrative reviews. including entries made on"
"827","Consumer Protection Act of 1997 - Amends the Federal Deposit Insurance Act to require the Federal"
"828","Chimney Rock National Monument Establishment Act - Establishes the Chimney Rock"
"829","Home Health Care Planning Improvement Act of 2007 - Amends title II (Medicare)"
"830","Amends the Internal Revenue Code to allow the taxpayer to make such credit for the credit for"
"831","Commission to Study the Potential Creation of a National Women's History Museum. Require"
"832","Graduation Really Achieves Dreams Act or the gaRAD Act - Re"
"833","Equal Advancement of Pay Act or the GAP Act - Amends the Fair Labor"
"834","Strengthening Community Safety Act of 2010 - Amends the Homeland Security Act of 2002"
"835","Working Families Tax Protection Act of 2012 - Amends the Economic Growth and Tax"
"836","Workers' Rights Principles for United States Businesses to establish principles on workers' rights for United"
"837","Bitk-th&gt; and (2) hire personnel and Purchase equipment to assist the enforcement"
"838","Academic and Reward Future Math and Science Teachers of America Act of 1998 - Amends"
"839","temporary IRA Distribution Suspension Act of 2008 - Directs the Internal"
"840","Gas Pump Access Act of 2016 This bill directs the President of the Treasury to provide accessibility to"
"841","Deccennial Census Improvement Act of 1997 - Directs the Bureau of the Bureau of"
"842","Amends the Intellectual Property Assembly of the Americas. Authorizes the President pro "
"843","Medicare Chronic Care Practice Research Network Act of 2007 - Directs the Secretary of Health and Human"
"844","Employees' Compensation Reform Act of 2011 - Amends the Social Security Act to require"
"845","Caribbean National Forest Wild and Scenic Rivers Act of 2002 - Amends the"
"846","Handling of Spent Nuclear Fuel Act of 1995 - Requires the President determine"
"847","multilingual Education and Technological Advancement Act of 2001 - Authorizes the Secretary of"
"848","Making Support for Missing and Exploited Children Act of 2017 This bill amends the Miss"
"849","Prevention Foundation Foundation for Investment in Microentrepreneurs Act of 1999 - Amends the "
"850","Contruction Subcontractors Payment Protection Enhancement Act of 1998 - Amends the Office"
"851","Basketball Financing and Franchise Relocation Act of 1999 - Amends the Federal Trade"
"852","Colonias Improvement Act of 2014 - Directs the Administrator of the Environmental Protection Agency ("
"853","Directs the Secretary of State to submit a report to the Congress and to the Secretaria"
"854","Tribal Connect Act of 2017 This bill amends the Communications Act of 1934 to require the library"
"855","Alzheimer's Act of 2008 or theLa Cura Act of 2008 or theLa Cura"
"856","Health Care Consumer Protection Act of 1995 - Directs the Secretary of Health and Human Services ("
"857","Fighting-Based Drug Treatment Enhancement Act - Amends the Public Health Service Act to"
"858","Small Business Reform Act of 2010 or the Not Too Small to Succeed in Business Act of"
"859","Veterans' Education and Training Act of 1994 - Amends the Federal law to authorize the"
"860","Amends the Internal Revenue Code to allow the taxpayer. or the donee. Requi"
"861","Homeownership Vesting Plan Act of 2009 - Amends the Housing and Economic Relief"
"862","Commission on Urotrauma conducted by the Secretary of Defense to establish a commission to be"
"863","Amends the Internal Revenue Code to exclude any dividends from domestic corporations. or (2) interest"
"864","Communitiessense Reporting and Verification Act of 2015 This bill directs the Secretary of the"
"865","Education in Vocational Technology Act - Authorizes the Secretary of Education to make grants"
"866","Prevention Access to Medicare Midwifery Services Act of 2000 - Amends title II ("
"867","Civil Justice Tax Fairness Act of 2013 - Amends the Internal Revenue Code to allow"
"868","Justice and Understanding By International Loan Elimination and Equity Act of 2004 or the JuUBILEE"
"869","Foreign Service Overseas Pay Equity Act of 2008 - Amends the Foreign"
"870","Rettungsfields Remediation Waste Act - Amends the Solid Waste Disposal"
"871","Nuclear Policy and Posture Review Act of 2007 - Directs the President to conduct a"
"872","Womens Without Hunger Act - Amends the Richard B. Russell National School Lunch Act"
"873","Medicare Drug Card Guaranteed Savings Act - Amends title XVIII ("
"874","Pharmacy Supply and Value Enhancement Act or thePharmaceutical SAVE Act or the"
"875","Local School Board Governance and Flexibility Act - Directs the Secretary of Education to provide local"
"876","Future of Electric Capacity Resources Act - Amends the Federal Power Act to direct"
"877","Streamlining Permitting of American Energy Act of 2012 - Amends the Mineral L"
"878","Historical Rehabilitation Tax Credit Expansion Act of 1993 - Amends the Internal Revenue Code"
"879","Southern Nevada Higher Education Land Act of 2008 - Directs the Secretary of the Interior"
"880","Amends Federal Criminal code to prohibit the procurement of specialty metals or chemical warfare protective clothing"
"881","Veterans Affairs Purchased Health Care Streamlining and Modernization Act - Amends title"
"882","Fortign Credit Reform Act of 2004 - Amends the Bretton Woods Agreements"
"883","Educational Opportunity for All Act of 2005 - Amends the Internal Revenue Code to allow taxpayer"
"884","freedom From Restraint Act of 1999 - Amends title XVIII"
"885","Amends the Trade Act of 1974 (WTO) of the Trade Act of 1974."
"886","Preservation of Access to Osteoporosis Testing for Medicare Beneficiaries Act"
"887","Amends the Internal Revenue Code to allow the credit for the credit for the credit for the"
"888","Airline Consumer Protection Act of 2017 This bill directs the Secretary of Transportation to issue a"
"889","Lorton Correctional Complex Closure Act - Amends the Lorton Correctional Complex"
"890","Prevention Readiness through Early Pell Act of 2016 or the PREP Act of 2016 This bill"
"891","Small Business Economic Impact Analysis Act of 2005 - Amends the Small Business Act to require"
"892","Medicare error Prevention Act of 2002 - Amends the Public Health Service Act to provide the"
"893","Cars Safety Act of 2003 - Directs the Secretary of Transportation to evaluate the available technologies"
"894","Bedaved Consumer's Bill of Rights Act of 2016 This bill directs the Federal"
"895","Amends the Civil Rights of Institutionalized Persons Act to revise provisions of"
"896","Border Security and Enforcement Act of 1997 - Establishes the Office of Enforcement and Border Affairs"
"897","Federal Employees Health Care Freedom of Choice Act - Amends the Internal Revenue Code to"
"898","Teaching Excessive Standardized Testing Act of 2015 or the TEST Act of 2015 This"
"899","Department FOIA Efficiency Act of 2015 This bill directs the Chief FOIA Officer of"
"900","Cocopah Lands Act - Directs the Secretary of the Interior to takes that"
"901","National Traumatic Brain Injury Research and Treatment Improvement Act of 2015 This bill directs the Secretary of"
"902","Amends the District of Columbia (DBA) to provide for the organization of the militia"
"903","Family Leave Tax Credit Act of 1993 - Amends the Internal Revenue Code to allow the"
"904","Making and Investment Act of 1993 - Amends the Internal Revenue Code to allow the deduction"
"905","Plan B for Plan B Act of 2005 - Amends the Food and Drug Administration ("
"906","Systemic Risk Designation Improvement Act of 2017 This bill amends the Dodd-F"
"907","Safe Food Act of 1999 - Establishes the Federal Meat Inspection Act to establish "
"908","Amends the International Security Assistance and Arms (NRA) to: (1) establish the"
"909","Uterine Fibroid Research and Education Act of 2003 - Directs the Director of"
"910","Amends the Attorney General to prescribe final regulations governing the storage and keeping by State and"
"911","Gun Show Loophole Closing Act of 2017 This bill amends the Federal criminal code to"
"912","Investment Transparency Act of 2014 - Amends the Securities Exchange Act of 1934 to"
"913","Veterans Programs Improvement Act of 2003 - Amends the Federal criminal code to increase the"
"914","equitablea Public Education Act of 1996 - Directs the Secretary of Education to provide for payment"
"915","Anti-Fraudulent Intercountry Adoption Practices Act of 1996 - Amend"
"916","Delhi Emihi Sands Flower-loving Fly. Requires the Secretary"
"917","Taxing Child Predators Act of 2016 This bill amends the Federal law to require the"
"918","Children's Environmental Health Protection Act - Directs the Administrator of the Office of Management"
"919","Responsible Stem Cell Research Act of 2001 - Directs the Secretary of Health"
"920","Immigration Services Consumer Protection Act of 2000 - Requires the person acting as an immigration"
"921","Amends the Internal Revenue Code to allow the United States Cruise Industry income Treated as Effective"
"922","Tennessee Dean Cheyenne River Valley Conservation Act of 2010 - Directs the Secretary of Agriculture"
"923","Energy investment for our Nation's Veteransa Energy Sustainability Technologies or theINVEST Act "
"924","Contlicts from Political Fundraising Act of 2017 This bill amends the Ethics of 1978"
"925","Digital Coast Act of 2012 - Directs the Secretary of Commerce to establish and implement the Digital"
"926","Hazard Savings and Resilient Construction Act of 2012 - Amends the Internal Revenue"
"927","Energy Conservation Opportunity Fund Act of 2008 or the Eco Fund Act of 2008 or the Eco Fund Act"
"928","Amends the National Aeronautics and Space Act of 1958 to authorize the Administrator of"
"929","Bankruptcy Fairness and Employee Benefits Protection Act of 2014 - Amends"
"930","Global Nuclear Security Initiative Act of 2002 - Directs the Secretary of Energy to develop a"
"931","Amends the Atomic Energy Act of 1954 to direct the Secretary of Energy to expend"
"932","Student Health Insurance Portability Protection Act of 1997 - Amends the Public Health Service Act"
"933","Amends the Indian Health Service to: (1) report directly to the Secretary of Health and Human"
"934","Federal Bureau of Investigation First Amendment Protection Act of 1993 - Directs the Federal Bureau of Investigation"
"935","Taxpayer Savings and Employee Notification Act of 2003 - Amends the Internal"
"936","Protectting Children from Sexual Exploitation Act of 2005 - Amends Federal criminal code"
"937","Motor Donor Act - Amends the Public Health Service Act to require the Secretary of"
"938","Media Violence Labeling Act of 1999 - Amends the Federal Cigarette Labeling"
"939","Healthy Families Act of 2013 - Directs the Secretary of Agriculture to establish the Local Food"
"940","TRANSparency and Honesty of Energy Regulations Act of 2017 This bill directs the"
"941","Salton Sea Reclamation Act of 1998 - Directs the Secretary of the Interior to"
"942","Jub Access and Workacentives Act - Amends the Transportation Equity Act for"
"943","Brownfields Housing and Community Renewal Development Act - Amends the Housing and"
"944","Medicare Beneficiaries' Choice Stabilization Act of 2000 - Amends title IV ("
"945","Clinton and National ParkDeferred Maintenance Act or the LAND Act - Amends"
"946","Amends the Internal Revenue Code to allow any applicable discharge costs of any taxpayer who are At"
"947","Counter Iran From Smuggling Weapons to Terrorists Act - Directs"
"948","Post-Prostate Cancer Treatment Equity Act of 2007 - Amends the Employee Retirement Income"
"949","Business Checking Freedom Act of 2003 - Amends the Federal Reserve Act to require the"
"950","State and Local Government Economic Empowerment Act - Directs the Secretary of the Treasury to"
"951","Taiwan Airpower Modernization Act of 2011 - Directs the Secretary of Defense to provide Taiwan"
"952","Private Property Rights Act of 1997 - Directs the Secretary of the Federal Government to"
"953","Breastograph Availability Act of 1999 - Amends the Public Health Service Act to require"
"954","Citizens Empowerment Act of 2015 This bill amends the Federal criminal code to prohibit any employee"
"955","Smart By Every Ad Act of 2010 - Amends the Federal Election Campaign Act of 1971"
"956","Electonic Books Opening Opportunity for Knowledge Act of 2014 or the E-BOOK Act of 2014 "
"957","World Trade Center National Memorial Act - Authorizes the Secretary of the Interior to establish "
"958","Taxax Ascentives for Fuel Efficient Vehicles Act of 2003 - Am"
"959","Special Olympics Sport and Empowerment Act of 2004 - Authorizes the Secretary of Education"
"960","Embassy Employee Compensation Act - Directs the Attorney General to: (1) administer"
"961","Hand Unrestricted on National Treasures Act or the HUNT Act - Am"
"962","Social Security Outreach Act of 1993 - Directs the Secretary of Health and Human Services (H"
"963","Domestic Violence Courts Assistance Act - Amends the Omnibus Crime Control and Safe Street"
"964","Student Loan Abuse Prevention Act of 2005 - Amends the Taxpayer-T"
"965","Personal Citizens' Freedom to Work Act - Amends title II (Medicare) of"
"966","Nuclear Safety and Promotion Act of 2001 - Amends the Atomic Energy Act of 1954"
"967","National Transportation Safety Board Amendments of 1996 - Amends the Federal criminal code to prohibit"
"968","Environmental Protection Encouragement Act of 1993 - Amends the Internal Revenue Code to allow taxpayer"
"969","Amends Federal criminal code to authorize the court to award a plaintiff prevailing with any"
"970","Upper Mississippi Conservation and River Protection Act of 2013 or the Upper Mississippi CARP Act "
"971","Natural Disaster Mitigation Act of 2011 - Amends the Internal Revenue Code to allow"
"972","Protectting Railroads against ENemy Efforts through Modernization. Planning."
"973","National Policies Toward Gambling Review Act of 1995 - Establishes the National Policies "
"974","Equal Oral Health Care Act of 2009 - Amends title IV (Medicare)"
"975","Veterans-Owned Small Business Promotion Act of 2009 - Amends the"
"976","Harriet Tubman National Historical Parks Act - Establishes the Harriet"
"977","Nuclear Secrets Safety Act of 2000 - Amends the National Nuclear Security Administration Act to"
"978","Children Improvement Act of 1999 - Amends the National School Lunch Act to authorize the Secretary"
"979","Hospital to Home- and Community-Care Linkage Development and Incentive Grant"
"980","Advancing Truth and Accountability of Campaign Communications Act of 2001 - Amends the"
"981","Federal Counterintelligence Act of 1994 - Amends the Fair Credit Reporting Act to require"
"982","Directs the Secretary of Transportation to establish the National Highway Traffic Safety Administration (NIA) to"
"983","coastal Restoration Tax Credit Act of 2005 - Amends the Internal Revenue Code to allow the"
"984","Hazard Safety and Security Act of 2002 - Amends the National Dam Safety Program Act to"
"985","Central American Security Act - Amends the Nicaraguan Adjustment and Central American Relief Act"
"986","Iran Nuclear Trade Prohibition Act of 2005 - Amends the Iranian and Libya San"
"987","Medicare Payment Improvement Act of 2009 - Amends title II (Medicare) of the"
"988","Youth Opioid Use Treatment Help Act of 2017 or the YuOUTH Act "
"989","Federal court shall make available to the public documents sufficient to identify with particularity the statutory or"
"990","Quilesute Indian Tribe in the State of Washington. Requires the Secretary of"
"991","Authorizes the Secretary of Veterans Affairs to carry out the following Major medical facility projects as specified"
"992","Child Poisoning Reduction Act of 2006 - Amends the Toxic"
"993","Automatic Automaticization Act of 2010 - Amends the Federal criminal code to prohibit the Secretary"
"994","Cut Taxes for the Middle Class Act of 2014 - Amends the Internal Revenue"
"995","Directs the Secretary of the Interior to sell the fair market value. Requires the"
"996","National Security Whistleblower Protection Act of 2016 This bill amends the Federal criminal"
"997","Amends the Communications Act of 1934 to require a telecommunications carrier to notify"
"998","Amends the Federal criminal code to revise the provisions of the Federal Fisheries Act"
"999","Conservation Security Act of 1999 - Amends the Food Security Act of 1985 to require the"
"1000","Rural Housing Preservation Act of 2016 This bill amends the Housing Act of 1949 to require the Secretary"
"1001","Rocky Flats Environmental Technology Site Act of 2005 - Directs the Secretary of Energy to"
"1002","Militarygage and Rental Disaster Relief Act of 2007 - Amends the Robert T."
"1003","Sport Agent Responsibility and Trust Act - Authorizes the Secretary of Commerce to conduct Prohibi"
"1004","House Ethics Commission Establishment Act of 2007 - Establishes the Independent Ethics Commission within"
"1005","Commercial Sense Spending Act of 2005 - Amends the Balanced Budget and Emergency"
"1006","Green Railcar Enhancement Act of 2010 - Amends the Internal Revenue Code to allow"
"1007","Veterans Sexual Assault Prevention and Health Care Enhancement Act - Amends Federal criminal"
"1008","Rocky Mountain National Park Wilderness and Indian Peaks Wilderness Expansion Act "
"1009","Amends the Federal Immigration and Nationality Act to establish and implement a program to identify"
"1010","Veterans Education Equity Act of 2011 - Amends the Federal law to: (1) the actual"
"1011","Rhhinoceros and Tiger Conservation Act of 1998 - Amends the Rhin"
"1012","Wireless Microphone Users Interference Protection Act of 2013 - Directs the Federal Communications Commission ("
"1013","Medicare Device Safety Monitoring Act - Amends the Federal Food. Drug. and Cosmetic Act"
"1014","Strength Communities Grow Strong Communities Act of 2014 - Directs the Secretary of Agriculture to administer the"
"1015","Endaging Work and Supporting Marriage Act of 2002 - Amends the Internal Revenue Code"
"1016","Amends the Communications Act of 1934 to require the subscriber's selection of a"
"1017","Federal Employees Health Benefits Provider Integrity Amendments of 1997 - Amends"
"1018","Federal Employee Rights Act - Amends Federal criminal code to prohibit the pay of any employee"
"1019","Amends the Internal Revenue Code to: (1) increase tax tax for tax for gasoline. diesel"
"1020","Puget Sound Sound Regional Shellfish Settlement Act of 2006 - Authorizes the Secretary of"
"1021","Endhalncing America's Security through Strategic Redeployment from Iraq Act -"
"1022","Military Spouses Residency Relief Act - Amends the Servicemembers Civil"
"1023","Authorizes the Secretary of Education to award grants to eligible local educational agencies to award bonuses to"
"1024","Directs the Chief of the National Guard and Air National Guard (ArmArm) to provide the"
"1025","Orange Mountain Wilderness Act of 1998 - Directs the Secretary of the Interior to:"
"1026","Freedom to Serve Without Fear Act of 2011 - Amends Federal law to prohibit any person"
"1027","Childcare Accountability and Responsibility Act of 2009 or the Care for Kids Act of 2009 or the"
"1028","Amends the Federal Food. Drug. and Cosmetic Act to require the Secretary of Health and"
"1029","Small Business Employment and Education Enhancement Act of 2001 - Amends the Department of Education"
"1030","Medicare Fraud Recovery Act of 2008 - Amends title II (Medicaid) of"
"1031","directs the Secretary of the Interior to the Interior to the Secretary of the Interior to the Secretary"
"1032","Low Volume Motor Vehicle Manufacturers Act of 2015 This bill amends the Federal Motor Vehicle Safety Standards"
"1033","Service for Schools Act of 2015 This bill amends the National and Community Service Act of 1990 to"
"1034","Medicare Physician Payment Act of 2013 - Amends title IV (Medicare) of the"
"1035","Head Start Assessment Act of 2003 - Directs the Secretary of Health and Human Services (H"
"1036","Health Care OverUse Reform Today Act of 2011 - Amends the Public Health"
"1037","Drug Abuse Treatment on Demand Assistance Act - Amends the Public Health Service Act to"
"1038","National September 11 Memorial & Museum Commemorative Medal Act of 2010 - Directs the"
"1039","Democracy Collection Act Amendments of 1993 - Amends Federal federal crime code to authorize the"
"1040","Social Security Trust Funds Management Act of 1999 - Amends title II (Medicare"
"1041","Gawed Students Education Act of 2003 - Amends the Elementary and Secondary Education"
"1042","Prope for the Common Defense Act of 2013 - Amends the Balanced Budget and"
"1043","Consumer Price Index for Elderly Consumers Act of 2015 This bill amends the Social Security Act"
"1044","United States Secret Service Accountability and Improvement Act of 2014 - Establishes the independent advisory"
"1045","United States Employee Ownership Bank Act - Directs the Secretary of the Treasury to establish the"
"1046","Iraqi Women Act of 2006 - Directs the Administrator of the United States Agency for International"
"1047","Amends the Internal Revenue Code to allow the deduction for qualified postsecondary education expenses for"
"1048","Border Health Security Act of 2015 This bill amends the United States-Mexico Border Health"
"1049","Directs the Secretary of Energy to conduct a survey to determine the 10- highest-prior"
"1050","Financial Literacy and Education Coordinating Act of 2003 - Directs the Secretary of the Treasury"
"1051","Prevention Card Waste Elimination Act of 2006 - Directs the Administrator of the Office of Management"
"1052","Stop Adolescent Smoking Without Excessive Bureaucracy Act of 2008"
"1053","National Building Here At Home Act of 2017 This bill directs the Secretary of Transportation to establish "
"1054","Humanitarian Assistance Facilitation Act of 2013 - Amends the International Emergency Economic Power"
"1055","Child Protection Compact Act of 2011 - Amends the Ambassador-at-Large"
"1056","Alcohol's Law of 2014 - Amends Federal criminal code to require the Secretary of"
"1057","Amends the Department of Transportation (DOT) to make appropriate arrangements with the Transportation Research Board"
"1058","Food and Medicine for the World Act of 1999 - Requires the President to "
"1059","Emergency Contingency Fund for Needy Families Programs (Emergency Conting"
"1060","directs the Secretary of Defense to: (1) the availability of such exemptions. Directs the"
"1061","Foreign Investment Transparency and Security Act of 2006 - Amends the Homeland Security Act"
"1062","Authorizing the Regulation of Swaps Act - Amends the Securities Exchange Act of"
"1063","Student Right to Know Before You Go Act of 2015 This bill amends the Higher Education Act of"
"1064","Upporting America's Young Entrepreneurs Act of 2016 This bill amends the Higher Education"
"1065","Catching Operational Vulnerabilities by ENsuring Random Testing Act of 2008"
"1066","Care Coordination for Older Americans Act of 2012 - Amends the Older"
"1067","Building Financing Renewal Act of 2003 - Amends the Internal Revenue Code"
"1068","freedom and Human Rights for the Enclaved People of Cyprus Act - Directs"
"1069","Amends the Higher Education Act of 1965 to authorize the Secretary of Education to award grants to"
"1070","Directs the Secretary of the Interior to convey to the Secretary of the Interior to convey to Lake"
"1071","Children's Education Tax Credit Act - Amends the Internal Revenue Code"
"1072","Marine Mammal Protection Act Amendments of 2002 - Amends the Marine Mamm"
"1073","Lawender Offense Victim Exoneration Act of 2017 or the LinOVE Act of 2017"
"1074","Amends the Internal Revenue Code to allow the advanced mine safety equipment property for use of the"
"1075","directs the Secretary of Education to discharge any loans under parts B and D of title IV of"
"1076","Amends the Congressional Budget Act of 1974 to revise the budget resolutions."
"1077","Meneat Promotion Act of 2005 - Amends the Agricultural Marketing Act of 1946 to"
"1078","Building Energy Tax Credit Act of 2009 - Amends the Internal Revenue Code to allow the"
"1079","Agricultural Credit Act of 2001 - Amends the Consolidated Farm and Rural Development Act"
"1080","Continued Participation Pension Act of 1996 - Amends the Employee Retirement Income"
"1081","Traum/TBI Guaranteed Review For Heroes Act - Amends the Federal criminal code"
"1082","Amends Federal criminal code to prohibit the Secretary of Commerce to issue the applicant a license"
"1083","Obamacare Marriage Penalty Elimination Act - Amends the Internal"
"1084","Trafficlling Sales Crew Protection Act - Amends the Fair Labor Standards Act of 1938 to"
"1085","Morley Nelson Snake River Birds of Prey National Conservation Area (BIA Boundary"
"1086","Canyon Mountain Land Conveyance Act of 2013 - Directs the Secretary of"
"1087","Making Treatment for Pregnant and Postpartum Women Act of 2016 This bill amends"
