"ID","Predict"
"1627","Japanese Imperial Army Disclosure Act - Establishes the Japanese Imperial Army Records Interagency Working"
"1628","Juvenile Corrections Act of 1997 - Authorizes the Administrator of the Office of"
"1629","Fortign Counterfeit Merchandise Prevention Act - Amends the"
"1630","Guard and Reserve Readiness and Retention Act of 2004 - Amends the Federal"
"1631","Small Business Health Information Technology Financing Act of 2009 - Amends title II ("
"1632","Gulf Coast Back to Business Act of 2007 - Authorizes the Secretary of Commerce to make"
"1633","Breast Cancer Patient Education Act of 2012 - Amends the Public Health Service Act to require"
"1634","Independent Bipartisan Commission on Campaign Finance Reform Act of 1997 - Establishes the Independent Bi"
"1635","Tax Practice and Marksmanship Training Support Act - Amends the Pittman-"
"1636","Jucial Transparency and Ethics Enhancement Act of 2006 - Amends Federal law"
"1637","Cormorant Management and Natural Resources Protection Act - Amends the Migratory Bird"
"1638","Tax Relief for Victims of Disasters Act of 2011 - Amends the Internal"
"1639","Amends the Association of American State Geologists to: (1) promote. advance and protect the"
"1640","Holocaustpice Evaluation and Legitimate Payment Act of 2013 - Amends title "
"1641","National Neurological Diseases Surveillance System Act of 2010 - Amends the"
"1642","Preserving Medicare Advantage for ALL Medicare Beneficiaries Act of 2015 This bill amends title "
"1643","Establishes the Federal Reserve Reserve. and the Air National Guard. its retirees."
"1644","NSPD Termination Act - Amends the Housing and Economic Recovery Act of 2008 to"
"1645","Millennium Challenge Compact Improvement Act of 2003 - Amends the Millennium Challenge Act of 2003 to"
"1646","Stamping Up Manufacturing Act of 2012 - Amends the Internal Revenue Code to allow the"
"1647","Promote Accountability and Government Efficiency Act - Requires any employee or applicant for employment"
"1648","Adoption Promotion Act of 1996 - Amends the Internal Revenue Code to allow the credit"
"1649","Federal Supported Health Centers Assistance Act of 1995 - Amends the Public Health"
"1650","United States-Israel Enhanced Security Cooperation Act of 2012 - Directs the Secretary of"
"1651","Interest on Business Checking Act of 2001 - Amends the Federal Reserve Act to"
"1652","Federal Mail Savings Act - Amends the Legislative Branch Appropri"
"1653","Rural Law Enforcement Assistance Act of 1997 - Authorizes the Board of Directors First appointed to"
"1654","Amends the Food Security Act of 1985 to require the Secretary of the Interior to: (1)"
"1655","Pipeline Improvement and Preventing Spills Act of 2015 This bill amends the Federal"
"1656","Amends the Internal Revenue Code to allow the taxpayer to allow the taxpayer to allow the taxpayer"
"1657","Chickasaw National Recreation Area Land Exchange Act of 2004 - Directs the Secretary of the"
"1658","Immigration Anti- Discrimination Improvement Act of 1993 - Amends the Immigration and National"
"1659","Glo Our Own Directive: Physician Assistant Employment and Education Act of 2015 This bill directs the Secretary"
"1660","Satlite Home Viewer Protection Act of 1996 - Amends the Federal criminal code to"
"1661","Amends title IV (Old Age Age Age Age Age Age Age Age Age Age"
"1662","Prevention and Testing Reform Act of 2014 - Amends the Federal Meat Inspection Act to"
"1663","Electronic Shipping Papers Act of 2014 - Directs the Secretary of Transportation to establish a"
"1664","Extended Payer Advancement. Rationalization. and Clarification Act or the SPARC Act"
"1665","Ronald Reagan Memorial Act of 2000 - Establishes the Ronald Reagan Memorial Commission to establish the"
"1666","Mohave County. Arizona. Requires the Secretary of the Interior to offer for sale"
"1667","Americans Want to Work Act - Amends the Supplemental Appropriations Act"
"1668","Professional Sports Antitrust Clarification Act of 1996 - Requires the professional sports league"
"1669","Compact Impact Relief Act of 2016 This bill directs the Secretary of Health and Human Services (H"
"1670","Military Affairs Construction. Accountability. and Reform Act - Directs the Secretary of Veterans Affairs"
"1671","Troubled Asset Relief Program and related Authorities established by the Secretary of the Treasury to promulgate"
"1672","National Education Technology Corps Act or the Net Corps Act - Amends the Domestic Volunteer Service"
"1673","Home Protection Act of 2008 - Amends the National Manufactured Housing Construction"
"1674","Healthy Living Act - Amends title XVIII (Medicare) of the"
"1675","Energy Smith Inclusive Home Design Act of 2013 - Directs the Secretary of Housing and"
"1676","Settlement Trust Improvement Act of 2017 This bill amends the Internal Revenue Code to allow "
"1677","Montana Fish and Wildlife Conservation Act of 1998 - Directs the Secretary of the Interior to sell"
"1678","Establishes the Emergency TradeDeficit Commission (EPA) to: (1) establish a"
"1679","Private Security Officer Quality Assurance Act of 1997 - Amends the Federal criminal"
"1680","Border Enforcement Security Task Force Reauthorization Act of 2017 This bill amends the Homeland Security Act"
"1681","Hanford Reach as a recreational river under the Wild and Scenic Rivers Act to"
"1682","Veterans Employment Transition Act of 2010 - Amends the Internal Revenue Code to: (1) allow"
"1683","Clean Energy Technology Manufacturing and Export Assistance Act of 2011 - Directs the Secretary of Commerce to"
"1684","Fair And Immediate Release of Generic Drugs Act or the FAIR Generics"
"1685","Public Health Equity Act - Amends the Federal Food. Drug. and Cosmetic Act to"
"1686","Brooklyn Cleanup and Redevelopment Revolving Loan Fund Pilot Project Act of 1996 - Direct"
"1687","Smith-Mundt Modernization Act of 2012 - Amends the United States Information"
"1688","Access to Obstetric Care Act of 1993 - Directs the Secretary of Health and Human"
"1689","Student Disciplinary Fairness Act of 2015 This bill amends the Office of Ju"
"1690","Medicare Certified Registered Nurse First Assistant direct Reimbursement Act of 2001 - Amend"
"1691","Geneerating Antibiotic Antibiotic Antibiotic Inccentives Now Act of 2011 - Am"
"1692","Amends title XVIII (Medicare) of the Social Security Act (SSA"
"1693","CT Modernization Act - Amends Federal Federal Deposit Insurance Act to require a De"
"1694","Waco Mammoth National Monument Establishment Act of 2011 - Establishes the"
"1695","Mete Hydrate Research and Development Amendments Act of 2015 This bill amends the Methan"
"1696","Comprehensive Fentanyl Control Act - Directs the Secretary of the Congress that: (1)"
"1697","Commission on Probabilistic Methods Act - Directs the Commission of Transportation (DOE)"
"1698","Phlymouth 400th Anniversary Commemorative Coin Act of 2017 This bill directs the Secretary"
"1699","Trade and Environment Reporting Act of 1994 - Directs the United States Trade Representative to consult"
"1700","Local Emergency Health Services Reimbursement Act of 2002 - Amends the"
"1701","Student Credit Card Transparency Act of 2009 - Amends the Truth of the Truth"
"1702","Small Business Jobs Act of 2015 This bill amends the Internal Revenue Code to allow the small employer"
"1703","Revolving Door Sunshine Act of 1993 - Amends the Sunshine Act to require any"
"1704","congressional Accountability for Regulatory Information Act of 2000 - Amends Federal law to require"
"1705","New Jersey Marine Ecosystem Protection Act of 1996 - Directs the Administrator of the Environmental Protection"
"1706","Amends the Food Security of 1985 to require the Secretary of Commerce to promulgate regulations"
"1707","Amends Federal Criminal Code to authorize the Court of Veterans Appeals to provide funds to provide"
"1708","Investmentas Notre Future Act of 2011 - Amends the Internal Revenue Code to prohibit"
"1709","Gas Price and Refinery Capacity Relief Act of 2013 - Amends the"
"1710","School-Based Respiratory Health Management Act - Amends the Public Health Service Act"
"1711","USDA Civil Rights Resolution Act of 2000 - Amends the Agriculture. Rural Development. Food"
"1712","freedom of Choice Act - Authorizes the Supreme Court to establish the right to privacy"
"1713","Water Infrastructure Resiliency and Sustainability Act of 2015 This bill directs the Administrator of the Environmental"
"1714","Amends the Marine Mammmal Protection Act of 1972 to require the Secretary of Marine Ma"
"1715","National Security Readiness Act of 2003 - Amends the Marine Mammmal Protection Act"
"1716","Racpid DNA Act of 2014 - Amends the DNA Identification Act of 1994 to require"
"1717","Child Nutrition Protection Act of 1994 - Amends the National School Lunch Act to require the"
"1718","Rocky Mountain Front Heritage Act of 2013 - Establishes the Rocky Mountain Front Conservation Management Area"
"1719","New Economy Workforce Act - Amends the Immigration and Nationality Act to require the"
"1720","Federal Protective Service Reform and Enhancement Act of 2010 - Amends Federal Protective"
"1721","Copology Tax Fairness and Compliance Act of 2003 - Amends the Internal Revenue Code"
"1722","Emergency Defibrillation Act of 2001 - Amends the Public Health Service"
"1723","Preserving Access to Manufactured Housing Act of 2013 - Amends"
"1724","Fallen Timbers Battlefield and Fort Miamis National Historical Site Act - Establishes"
"1725","CyberTheft Act - Directs the Director of National Intelligence to submit to"
"1726","Office of Surgeon General Sunset Act - Directs the Assistant Secretary for Health and Human Services"
"1727","Infrastructure Reinvestment and Economic Revitalization Act of 1993 - Amends the Internal"
"1728","Amends the Interior to establish the advisory committee under the Federal Advisory Committee (FCC"
"1729","Energy and Climate Policy Act of 1999 - Establishes the Energy Policy Act of 1992 to"
"1730","Marine Mammal Rescue Assistance Act of 1999 - Amends the Marine Mammal"
"1731","Clear Creek National Recreation Area and Conservation Act of 2012 - Directs the Secretary of the Interior"
"1732","Contruction Reform. Authorization. and Choice Improvement Act of 2015 This bill amends the Federal"
"1733","Amends the Internal Revenue Code to increase the tax rate for dividends received by a"
"1734","Hurricane Sand Dunes National Recreation Area Act of 2014 - Establishes the Hurricane Sand Du"
"1735","Public Land Management Participation Act of 1997 - Amends the National Historic Preservation Act to"
"1736","International and Foreign Language Studies Act of 2004 - Amends the Higher Education Act of 1965"
"1737","Long Island Sound Protection Act - Amends the Marine Protection. Research. and Sanc"
"1738","Loan Enhancement Through Necessary Due Process Act - Amends the Federal Deposit"
"1739","Rural Health Care Protection Act of 1997 - Amends title XVIII (Medic"
"1740","Balanced Trade Restoration Act of 2006 - Directs the Secretary of Commerce to establish a"
"1741","Independent Investment Account Act of 1999 - Amends the Internal Revenue Code to allow the deduction"
"1742","Provinces the Northern Mariana Islands for purposes of employment in the Textil. hotel. tourist."
"1743","FoodAllergy and Anaphylaxis Management Act of 2009 - Directs"
"1744","Drug Price Competition Act of 2009 - Amends the Federal Food. Drug. and Cosmetic"
"1745","Veterans' Compensation Rate Amendments of 2001 - Amends the Federal criminal code to authorize"
"1746","Transferation Information Recall Enhancement Act - Amends Federal criminal code to require the"
"1747","Hibben Center for Archaeological Research Act of 2002 - Authorizes"
"1748","Discretionary Spending Control Act of 2004 - Amends the Balanced Budget"
"1749","Occupational Safety and Health- Fairness Act of 2003 - Amends the Occupational Safety"
"1750","Homeland Security Volunteerism Enhancement Act of 2005 - Amends the Homeland"
"1751","Superfund Recycling Equity Act of 1995 - Amends the Comprehensive Environmental Response. Compensation."
"1752","Armed Forces Education Benefits Improvement Act - Amends Federal law to authorize"
"1753","Electronic THEft (NET) Act - Amends Federal criminal code to prohibit any"
"1754","Economic Modernization Act - Amends the Internal Revenue Code to allow the employer of payroll"
"1755","Workplace Religious Freedom Act of 1999 - Amends the Civil Rights Act of 1964 to"
"1756","Medicare Nonprofit Hospital Protection Act of 1997 - Amends title XVIII of"
"1757","Guidance. Understanding. and Information for Dual Eligible Individual Defines """""
"1758","Voluntary Medicare Prescription Drug Plan Act of 2000 - Amends title X"
"1759","National Fish and Wildlife Policy Fellowship Act of 2004 - Directs the Secretary of the Interior to"
"1760","Public Infrastructure Modernization Act of 2013 - Directs the Secretary of the Army to approve or"
"1761","Worker Protection Against Combustible Dust Explosions and Fires Act of 2011"
"1762","Health Care Coverage Assistance for the Unemployed Act of 2001 - Directs the Secretary of"
"1763","Amends the National Park System or National Park Service. Requires the Secretary of"
"1764","Medicare-Midnight Rule Coordination and Improvement Act of 2014 - Directs the"
"1765","Voluntary Protection Program Act - Directs the Secretary of Labor to establish a program"
"1766","Bullying and Gang Prevention for School Safety and Crime Reduction Act of 2005 - Am"
"1767","Wilderness Act of 2016 This bill directs the Secretary of Agriculture to submit to the Committee"
"1768","Federal Land Exchange Improvement Act of 1995 - Amends the Federal Land Policy and Management Act"
"1769","restores the Secretary of Agriculture and Sciences Sciences Sciences Sciences Sciences Sciences Sciences Sciences Sciences Sciences Sciences Sciences"
"1770","Wild Sky Wilderness and Backcountry Wilderness Management Area Act of 2004 - Direct"
"1771","Identification theft and Taxfraud Prevention Act - Amends the Internal Revenue Code"
"1772","Reciprocity and Fairness of Foreign Investment Act - Authorizes the Secretary of"
"1773","Amends the President to require the Secretary of Homeland Security to exclude from the United States to"
"1774","Apples for Teachers Act - Amends the Internal Revenue Code to allow eligible teachers to"
"1775","Preserving and Reforming SSDI (PAR- SSDI) Act of 2016 This"
"1776","Amends Federal federal criminal code to authorize the Board to promulgate regulations adopting "
"1777","Authorizes the Chief Administrative Officer of the House of Representatives on Capitol Grounds. Re"
"1778","Traumatic Brain Injury Act of 2008 - Amends the Public Health Service Act to require"
"1779","Opioids (ALTO) as the Emergency Department Act - Directs the Secretary of"
"1780","Minority Business Development Improvements Act of 2009 - Authorizes the Director of the Minor"
"1781","Social Security Retirement Account Act of 1993 - Amends the Internal Revenue Code to allow employer"
"1782","Amends the Energy Policy Act of 2005 to require applicants for and recipients of loan guarantees to"
"1783","Brownfield Redevelopment and Economic Development Innovative Financing Act of 2014 - Directs the"
"1784","Medicare Fraud Enforcement and Prevention Act of 2010 - Amends title XVIII"
"1785","Telephone Viewer Privacy Act of 2003 - Requires the subscriber to any subscribe"
"1786","First-time Homebuyer Affordability Act of 1999 - Amends the"
"1787","Amends the Internal Revenue Code to allow the deduction for the taxable year the aggregate amount"
"1788","Right to Repair Act of 2005 - Directs the manufacturer of a motor vehicle sold or"
"1789","Generic Pharmacy Access and Choice for Consumers Act of 2000 - Amends the Public"
"1790","BankOn Our Communities Act of 2009 - Amends the Emergency Economic Stabilization Act"
"1791","No Qualified Teacher Left Behind Act of 2004 - Amends the Elementary and Secondary"
"1792","Housing Opportunity and Mortgage Equity Act of 2013 - Directs the Federal National Mortgage Association and the"
"1793","Student Loan Simplification and Opportunity Act of 2011 - Amends the Higher Education Act of"
"1794","Information Classification Act of 1994 - Amends the National Security Act of 1947 to require"
"1795","Amends the Immigration and Nationality Act to require the Attorney General to that of an alien"
"1796","Cancer Drug Coverage Parity Act of 2011 - Amends the Employee Retirement Income Security"
"1797","National Nurse Act of 2011 - Amends the Public Health Service Act to establish within the"
"1798","White House Inspector General Act of 1996 - Amends the Inspector General of the Executive Office"
"1799","Medicare. Medicaid. and MCH Tobacco Cessation Promotion Act of 2004 -"
"1800","Competive and Open Markets That Protect and Enhance the Treatment of Entrepreneurs Act of 2007"
"1801","Fair Justice Act of 2001 - Establishes the Fair Justice Agency (F Justice Agency ("
"1802","Enhancuring Quality as the Unemployment Insurance Program (EQUIP) Act - Amend"
"1803","Homeland Security Act - Establishes the Commission on Homeland Security (DHS) to study"
"1804","Indian Youth Telemental Health Demonstration Project Act of 2006 - Authorizes"
"1805","Nuclear Facility and Material Security Act of 2008 - Directs the Nuclear Regulatory Commission (NR"
"1806","Ocean Commemorative Coins Act - Directs the Secretary of the Treasury to issue silver"
"1807","Building Ice and Snow Prevention Pilot Program Act of 2009 - Directs the Secretary of Transportation to"
"1808","Treats the Secretary of the Interior to: (1) the National Oceanic and Atmosphe"
"1809","Disease Research and Awareness Act - Amends the Public Health Service Act to authorize the Secretary"
"1810","Public School Redefinition Act of 1993 - Authorizes the Secretary of Education to"
"1811","Regulatory Capture Prevention Act of 2011 - Establishes the Office of Regulatory Integrity"
"1812","Opportunities for Success Act of 2013 - Directs the Secretary of Education to establish"
"1813","Military East and North Africa Transition and Development Act - Requires the Federal Federal Federal"
"1814","Housing Authority Funding Fairness Act of 2007 - Amends the United States Housing Act"
"1815","Youth Smoking Prevention Act of 1995 - Amends the Public Health Service Act to prohibit"
"1816","Alert Lives through Effective and Reliable Technological Systems Act of 2008 or theALERTS"
"1817","Medicare and Medicaid Provider Review Act of 1997 - Amends title XVIII"
"1818","Amends the Tariff Act of 1930 to: (1) liquidate or reliquidate"
"1819","Directs the Secretary of State to provide briefings to Congress on any discussions conducted between any"
"1820","Fighting Crimes Resources Act of 2009 - Authorizes the Director of the United States Secret"
"1821","Student Medical Access Raising Test Scores Health Act or theSMARTS Health Act -"
"1822","Strategymodium Sustainment Act of 2007 - Directs the Secretary of Defense to"
"1823","Nine/11 Commission Civil Liberties Board Act - Amends the Intelligence Reform and"
"1824","Maril Well Production Preservation and Enhancement Act - Amends the Internal Revenue Code to"
"1825","Amends Federal law to establish a 3-year program to provide employees and agencies with alternative"
"1826","Television Violence Reduction Through Parental Empowerment Act of 1993 - Amends the"
"1827","Long Underground Storage Tank Trust Fund Amendments Act of 1997 - Amends the Solid Waste"
"1828","United States Information Agency Authorization Act. Fiscal Years 1994 and 1995 - Amends the"
"1829","Jobbs Now Act of 2017 This bill amends the Workforce Innovation and Opportunity Act to"
"1830","Amends the Internal Revenue Code to: (1) return with respect to domestic service employment taxes to"
"1831","Modified Line Item Veto/Expedited Rescissions Act of"
"1832","Helfering Individuals Return to Employment Act or the HIRE Act - Authorizes the"
"1833","Drug Trafficking Vessel Interdiction Act of 2008 - Amends Federal criminal code to"
"1834","Amends the Tariff Act of 1930 to: (1) liquidate or reliquidate"
"1835","congressional Medal of Honor Memorial Coin Act of 2003 - Directs the Secretary of the Treasury to"
"1836","Tempoorary Extension of Public Housing Reform Provisions Act of 1997 - Amends the"
"1837","Small Business Partners in Reconstruction Act of 2006 - Amends the Small Business Act to"
"1838","congressional Budget Office Improvement Act of 1998 - Amends the Congressional Budget Board and Economic"
"1839","Social Security Safety Dividend Act - Directs the Secretary of the Treasury to disburs"
"1840","Endangered Species Criminal and Civil Penalties Liability Reform Act - Am"
"1841","Reserve Component Tax Assistance Act of 2001 - Amends the Internal Revenue Code"
"1842","Amends the Federal criminal code to prohibit the payment of payment of such benefits."
"1843","Haoopa-Yurok Settlement Amendment Act of 2004 - Amends the H"
"1844","Student Loan Evaluation and Stabilization Act of 1995 - Amends the Higher Education Act"
"1845","unemployment Insurance Modernization Act - Amends title II (Old Age Age Age"
"1846","Amends the Internal Revenue Code to allow the disclosures necessary for Charity Employees and Board"
"1847","Homeless Veterans Prevention Act of 2015 This bill amends the Federal criminal code to authorize the Secretary"
"1848","directs the Secretary of Energy to direct the Secretary of Energy to direct the Secretary of Energy to"
"1849","Small Business Tax Certainty and Growth Act of 2013 - Amends the Internal Revenue"
"1850","flood Control Credit Act of 2013 - Amends the Flood Control Act of 1970"
"1851","Long-Term Care Act of 2008 - Amends the Internal Revenue Code to allow the"
"1852","ScoRE for Small Business Act of 2012 - Amends the Small Business Act to authorize"
"1853","Federal Air Marshals and Safe Sky Act of 2001 - Amends Federal air marshal"
"1854","Exempt Organization Simplification and Taxpayer Protection Act of 2013 - Amends the"
"1855","School Disorders Awareness. Prevention. and Education Act of 2003 - Amends the Elementary"
"1856","Federal Protection and Infrastructure Act of 1998 - Amends Federal criminal code to prohibit the violat"
"1857","Women's Health Protection Act of 2015 This bill amends the Fourteenth Amendment to the"
"1858","Amends the Farm Security and Rural Investment Act of 2002 to: (1) authorize the President to"
"1859","Outer Continental ShelfPermit Processing Coordination Act - Directs the Secretary of the Interior"
"1860","Metropolitan Accountability and Investment Act - Amends thepassenger Rail Investment and Improvement"
"1861","Personal Property Tax Relief Act of 1998 - Amends the Internal Revenue Code to allow the"
"1862","Voluntary Opportunities for Increasing Contributions to Education Act - Amends the Internal"
"1863","Breast Cancer and Environmental Research Act of 2001 - Amends the Public Health Service Act to"
"1864","Consumer Protection Home Inspection Counseling Act of 2012 - Amends the Dodd-"
"1865","Maggie's Law: National Drowsy Driving Act of 2002 - Amend"
"1866","Teachers For Tomorrow Act of 2001 - Amends the Higher Education Act of 1965 to"
"1867","Saystance for Orphans and other Vulnerable Children in Developing Countries Act of"
"1868","Truth in Regulating Act of 1999 - Directs the Comptroller General"
"1869","Education Debt Reduction Program - Amends the Federal criminal code to authorize the Secretary"
"1870","Prevention Regional Energy Partnerships for Advancing Resilient Energy Systems Act or thePR"
"1871","Comunity Hazard Assessment and Mitigation Program Act - Directs the Secretary of Homeland Security"
"1872","Core TaxDodging Prevention Act - Amends the Internal Revenue Code to allow the taxpayer"
"1873","Digital Television Transition and Public Safety Act of 2005 - Amends the Digital Television Transition and"
"1874","veterinarian Workforce Expansion Act of 2005 - Amends the Public Health Service Act"
"1875","Cooperative Agricultural Programs Extended Retirement Credit Act of 1993 - Directs the Secretary of"
"1876","Version Official Totals for Elections Act - Amends the Help America Vote"
"1877","National Hurricane Research Initiative Act of 2006 - Directs the Under Secretary for Oceans and At"
"1878","Employment Non-Discrimination Act of 1994 - Directs the Secretary of the Interior"
"1879","Criminal Chance Voting Rights Act of 2006 - Requires the Attorney General to:"
"1880","Fireino Veterans Fairness Act - Amends the Federal criminal code to require the"
"1881","Amends the Internal Revenue Code to allow the qualifying medical education interest (ARMARM) to"
"1882","Water Water Infrastructure Financing Act of 2005 - Amends the Federal Water Pollution"
"1883","Protecting Workplace Advancement and Opportunity Act - Directs the Secretary of Labor (D"
"1884","Emstern Sierra Rural Heritage and Economic Enhancement Act - Directs the Secretary of Agriculture to"
"1885","Cocopah Lands Act - Directs the Secretary of the Interior to undertake that"
"1886","National Icebreaker Fund Act of 2015 This bill amends the Federal Icebreaker Fund."
"1887","United States Marshals Service 225th Anniversary Commemorative Coin Act - Directs the"
"1888","British President and encourage the President to conclude a binational commission to establish a binational"
"1889","Amends the Elementary and Secondary Education Act of 1965 to authorize the Secretary of Education to award"
"1890","EQIP Improvement Act of 2018 This bill amends the Food Security Act of 1985 to require the"
"1891","Amends Federal aviation law to authorize the Secretary of Transportation to review the marketing practices of air"
"1892","Amends the Investment Advisers Act of 1940 to require the Secretary of Health and Human"
"1893","Refuge Children's Educational Advancement and Dropout Prevention Act of 2001 - Amends"
"1894","Coalition To Establish a Commonwealth of the Northern Mariana Islands as the United States of America."
"1895","Juson's Law - Directs the Secretary of Transportation to implement a pilot program"
